{
  "version": "0.1",
  "name": "Zwei-Massen-Kette",
  "description": "Two blocks connected in series by springs, hanging from the ceiling. Body-to-body spring test.",
  "gravity": [0, -9.81],
  "solver": { "dt": 0.001 },
  "view": { "center": [0, 0.5], "width": 2.5 },
  "bodies": [
    {
      "id": "m1",
      "type": "block",
      "position": [0, 0.5],
      "params": { "mass": 1.0, "width": 0.15, "height": 0.15 }
    },
    {
      "id": "m2",
      "type": "block",
      "position": [0.05, 0.0],
      "params": { "mass": 0.5, "width": 0.15, "height": 0.15 }
    }
  ],
  "elements": [
    {
      "id": "k1",
      "type": "spring",
      "a": { "body": null, "point": [0, 1.2] },
      "b": { "body": "m1", "point": [0, 0.075] },
      "params": { "k": 150.0, "rest_length": 0.5 }
    },
    {
      "id": "k2",
      "type": "spring",
      "a": { "body": "m1", "point": [0, -0.075] },
      "b": { "body": "m2", "point": [0, 0.075] },
      "params": { "k": 80.0, "rest_length": 0.3 }
    }
  ],
  "constraints": []
}
